{
  "$schema": "../runtime-observation-v1.schema.json",
  "schema_version": "evoom-public-runtime-observation-v1",
  "record_id": "v4.5.0-gvisor-31298956172",
  "scope": {
    "ownership": "same-owner",
    "source_repository_visibility": "private",
    "execution_environment": "github-hosted",
    "independent": false,
    "production": false,
    "field_evaluation": false,
    "hostile_host": false
  },
  "source_run": {
    "repository": "EvoRiseKsa/evoom-guard-system-acceptance-private",
    "pull_request": 10,
    "run_id": 31298956172,
    "run_attempt": 1,
    "event_name": "pull_request",
    "base_sha": "51fcad5bc40628b0810099621cff9b189479647f",
    "head_sha": "c2583e988420e7f594bb48ae58f09b5ea7c64e99",
    "event_merge_sha": "5e69ea9c8b79d6f74dd05a9d503564a52c643f3d",
    "workflow_path": ".github/workflows/release-bound-gvisor-v45.yml",
    "workflow_blob_sha": "e72ed5befeeff24c3ef6c05aa56f73f69a376949",
    "merge_commit_sha": "564545f98bc5c74d9d66bbf99fa5785f404d9928"
  },
  "release_binding": {
    "repository": "EvoRiseKsa/EvoOM-Guard-m",
    "tag": "v4.5.0",
    "commit": "6bb4c328e56661b661e50532886802c6ba36a997",
    "tree": "bd81a595ca8608ad7da04390f31d5e489f5083ef",
    "artifact": {
      "name": "evo-guard.pyz",
      "sha256": "44bf036666bc7bb2903b647f33b63254771771887de4f170c91e8cdd8307c89d",
      "size_bytes": 2356398
    },
    "ledger": {
      "path": "evidence/release-ledgers/v4.5.0/RELEASE_LEDGER.json",
      "sha256": "9ee6c49e7a3c93d611c34e208f5e3936f147bf0ed0b8ff2c41b3e53b891da239",
      "size_bytes": 33456
    }
  },
  "runtime_binding": {
    "provider": "gvisor",
    "runtime": "runsc",
    "tag": "release-20260803.0",
    "tag_object": "dce6e31c2dd2055542cc1d71dfceaefdcaf0e05c",
    "peeled_commit": "48de7274186ae2cbab2c8656c43a73d115227a61",
    "version_lines": [
      "runsc version release-20260803.0",
      "spec: 1.2.1"
    ],
    "archive": {
      "url": "https://storage.googleapis.com/gvisor/releases/release/20260803.0/x86_64/gvisor.tar.bz2",
      "sha512": "266ff0c74ba4faf137837c051e1d3c0a331bb1d3c152d791f349ef6680542d089b81f68e3c9f196a6fb82263909cfc583c39e98a0e058bb29c5ab752d9432805",
      "size_bytes": 143849577
    },
    "requested_image": "python:3.12-slim@sha256:229a2c5bfa27522db7815ea81f9bed70af17ccb9de9fc7ad142b1877b5830d36",
    "resolved_image_id": "sha256:54a0b2beae90fe14c2131f1e880e1388c9df77390bc260d7317e589765e064e8",
    "network": "none",
    "runner_os": "Linux",
    "runner_arch": "X64"
  },
  "conformance": {
    "raw_path": "raw/isolation-conformance.json",
    "suite_id": "evoom-guard-isolation-v1",
    "profile_id": "gvisor",
    "status": "pass",
    "profiles_total": 1,
    "profiles_passed": 1,
    "probes_total": 9,
    "probes_passed": 9
  },
  "verdict_cases": [
    {
      "id": "honest-pass",
      "raw_path": "raw/guard-honest-pass.json",
      "verdict": "PASS",
      "passed": true,
      "exit_code": 0,
      "reason_code": "tests_passed",
      "tests_passed": 2,
      "tests_total": 2,
      "files_changed": ["calc/ops.py"],
      "protected_violations": [],
      "execution_state": "completed",
      "execution_phase": "blackbox_pack",
      "verdict_source": "blackbox",
      "isolation": "gvisor",
      "runtime": "runsc",
      "network": "none",
      "resolved_image_id": "sha256:54a0b2beae90fe14c2131f1e880e1388c9df77390bc260d7317e589765e064e8",
      "launcher_receipt_assertion": "nonzero-not-an-audited-exact-call-count"
    },
    {
      "id": "broken-add-fail",
      "raw_path": "raw/guard-broken-add-fail.json",
      "verdict": "FAIL",
      "passed": false,
      "exit_code": 1,
      "reason_code": "tests_failed",
      "tests_passed": 0,
      "tests_total": 2,
      "files_changed": ["calc/ops.py"],
      "protected_violations": [],
      "execution_state": "completed",
      "execution_phase": "blackbox_pack",
      "verdict_source": "blackbox",
      "isolation": "gvisor",
      "runtime": "runsc",
      "network": "none",
      "resolved_image_id": "sha256:54a0b2beae90fe14c2131f1e880e1388c9df77390bc260d7317e589765e064e8",
      "launcher_receipt_assertion": "nonzero-not-an-audited-exact-call-count"
    }
  ],
  "cleanup": {
    "post_cases": {
      "path": "raw/residual-containers.txt",
      "sha256": "e3b0c44298fc1c149afbf4c8996fb92427ae41e4649b934ca495991b7852b855",
      "size_bytes": 0
    },
    "final": {
      "path": "raw/residual-containers-final.txt",
      "sha256": "e3b0c44298fc1c149afbf4c8996fb92427ae41e4649b934ca495991b7852b855",
      "size_bytes": 0
    }
  },
  "raw_inventory": [
    {
      "path": "raw/evidence-boundary.txt",
      "role": "scope-boundary",
      "sha256": "07b4faf529a2d107e75bc11a0334df008f941324fd9fd1e11601d1a11c7c6cdd",
      "size_bytes": 68
    },
    {
      "path": "raw/guard-broken-add-fail.json",
      "role": "negative-verdict",
      "sha256": "cdd3ab80c2357820097422f848226fe30dc3066ba2b05ec158d6b19b21879bae",
      "size_bytes": 8451
    },
    {
      "path": "raw/guard-honest-pass.json",
      "role": "positive-verdict",
      "sha256": "74fb1b7bf02f1e34d945d2d0ece44cb87a51a2728c3da14a1d3eac678e6e8db5",
      "size_bytes": 7967
    },
    {
      "path": "raw/gvisor-archive.sha512",
      "role": "archive-checksum",
      "sha256": "82fb04af6e803a24f48ae69a096a02539c796758b2d1b03a835dc7ed6e7186f2",
      "size_bytes": 195
    },
    {
      "path": "raw/gvisor-archive.size",
      "role": "archive-size",
      "sha256": "c617b4a5730cd0f600b16b7d43f4f0111c23581b88c7977d4986d49fbce46eda",
      "size_bytes": 10
    },
    {
      "path": "raw/gvisor-source-ref.txt",
      "role": "source-identity",
      "sha256": "8f2a686e358961081dfaf2995c768226d5f45a4230fcac0651dfd74a1f0daed0",
      "size_bytes": 143
    },
    {
      "path": "raw/isolation-conformance.json",
      "role": "conformance-result",
      "sha256": "f9f403a6c7b39d150012bb498fbba56543b113fb4bd9612c6fb458f06e8ec2ac",
      "size_bytes": 21042
    },
    {
      "path": "raw/observation.json",
      "role": "source-observation",
      "sha256": "f99cbf58a0f48a0e718dea72912df9be5e43090886bc49ee4734058ee69c0e2f",
      "size_bytes": 7163
    },
    {
      "path": "raw/residual-containers-final.txt",
      "role": "final-cleanup",
      "sha256": "e3b0c44298fc1c149afbf4c8996fb92427ae41e4649b934ca495991b7852b855",
      "size_bytes": 0
    },
    {
      "path": "raw/residual-containers.txt",
      "role": "post-case-cleanup",
      "sha256": "e3b0c44298fc1c149afbf4c8996fb92427ae41e4649b934ca495991b7852b855",
      "size_bytes": 0
    },
    {
      "path": "raw/runsc-version.txt",
      "role": "runtime-version",
      "sha256": "dad3a3ea1ffeb6fec6bc65e9c3732b9586cf94b2fe9c0f594fab94c0cdf1565d",
      "size_bytes": 45
    }
  ],
  "claims": [
    "This record binds one same-owner GitHub-hosted run to the exact v4.5.0 release artifact and signed release ledger named here.",
    "On that run, Docker selected runsc for the recorded checksum-pinned gVisor release, network mode was none, and the resolved container image ID matched this record.",
    "The release-shipped isolation conformance kit reported one passing gvisor profile and nine passing required probes.",
    "The external black-box verifier pack reported 2/2 for the honest case and 0/2 with reason_code tests_failed for the deliberately broken add case."
  ],
  "nonclaims": [
    "not an independent review or independently operated trust domain",
    "not a production deployment or field-efficacy result",
    "not a dedicated-host or hostile-host proof",
    "not an HSM, KMS, production key-custody, or signer proof",
    "not a multi-host, non-forking-ledger, rollback-resistance, or external-witness proof",
    "not a Firecracker, microVM, or dedicated guest-kernel proof",
    "not an independent proof that every installed sidecar reports or enforces the runsc release identity",
    "not an independent review of the private workflow; its Git blob is bound but its bytes are not retained here",
    "not proof that gVisor, Docker, the hosted runner, or the workflow is invulnerable",
    "not an audited exact count of candidate calls from the nonzero launcher receipts",
    "not a substitute for the signed v4.5.0 release ledger"
  ],
  "transfer": {
    "carrier": "github-actions-artifact",
    "source_run_id": 31298956172,
    "artifact_id": 9033891750,
    "artifact_name": "evoom-guard-v4.5.0-gvisor-31298956172-1",
    "artifact_digest": "sha256:3adeffcc910988b0f98f9e9970dcc5cfd16d5ab7902d349aa5c6c12a379b321b",
    "expires_at": "2026-08-23T06:29:32Z",
    "role": "transient-locator-not-source-of-truth",
    "transient": true,
    "durable_subset": "this-directory"
  }
}
